{
  "catalog_sha256": "2e41a33f4624edeeeb001ee63133f78a3e76b9d1f241a12ffc8a2fe59d58b2ae",
  "groups": [
    {
      "description": "CPU, memory, faults, and physical IO attributed to a process or cgroup.",
      "id": "system_resources",
      "label": "System resources"
    }
  ],
  "measurements": [
    {
      "aggregation": "counter",
      "description": "A direct bounded Linux kernel counter collected by ASB.",
      "evidence_limits": [
        "missing_is_unavailable",
        "requires_comparable_experiment",
        "collector_overhead_recorded"
      ],
      "group": "system_resources",
      "id": "cgroup.cpu.periods",
      "live": {
        "status": "supported"
      },
      "name": "Cgroup CPU periods",
      "overhead": {
        "class": "low",
        "minimum_interval_ns": 1000000,
        "requires_privilege": false
      },
      "platforms": [
        {
          "architectures": [
            "x86_64",
            "aarch64"
          ],
          "operating_system": "linux",
          "required_features": [
            "cgroup_v2"
          ]
        }
      ],
      "provenance": {
        "qualification": "unqualified",
        "source": "optional_csb"
      },
      "quantity": "count",
      "replay": {
        "status": "supported"
      },
      "scope": "cgroup",
      "unit": "{event}"
    }
  ],
  "schema_version": 1
}
